{
  "schema_version": 1,
  "install_id": "5b0e8f2c9a4d4e71b3c6a1f07d2e9b48",
  "hostname": "db-archive-03",
  "scanner_version": "0.1.0",
  "collected_at_unix_ms": 1790000600000,
  "packages": [
    {
      "manager": "rpm",
      "name": "bash",
      "version": "5.2.37"
    },
    {
      "manager": "dpkg",
      "name": "openssh-server",
      "version": "9.6p1",
      "release": "3ubuntu13.5",
      "epoch": 1,
      "arch": "amd64"
    }
  ]
}
