{
  "schema_version": 1,
  "install_id": "5b0e8f2c9a4d4e71b3c6a1f07d2e9b48",
  "hostname": "db-archive-03",
  "scanner_version": "0.1.0",
  "collected_at_unix_ms": 1790000600000,
  "packages": [
    {
      "manager": "rpm",
      "name": "openssl",
      "version": "3.2.2",
      "release": "1.fc44",
      "epoch": 1,
      "arch": "x86_64",
      "vendor": "Fedora Project"
    },
    {
      "manager": "rpm",
      "name": "systemd-libs",
      "version": "252",
      "release": "67.el9_8.2.rocky.0.1",
      "arch": "x86_64",
      "source": "systemd"
    },
    {
      "manager": "dpkg",
      "name": "openssh-server",
      "version": "9.6p1",
      "release": "3ubuntu13.5",
      "epoch": 1,
      "arch": "amd64"
    },
    {
      "manager": "dpkg",
      "name": "libssl3t64",
      "version": "3.0.13",
      "release": "0ubuntu3.5",
      "arch": "amd64",
      "source": "openssl"
    },
    {
      "manager": "dpkg",
      "name": "libpython3.12-stdlib",
      "version": "3.12.3",
      "release": "1ubuntu0.8+b1",
      "arch": "amd64",
      "source": "python3.12",
      "source_version": "3.12.3-1ubuntu0.8"
    }
  ],
  "os": {
    "id": "debian",
    "version_id": "12"
  },
  "running_kernel": "6.1.0-25-amd64"
}
